id,date_agreement,date_found,buyer,seller,capacity_mw,energy_gwh,tenure_years,country,technology,price_eur_mwh,source_url,source_outlet,publication_date,notes,is_update,original_deal_id
7,2024-01-06,2026-06-02,Evolve Energy Supply Ltd,Shell Energy Europe Ltd,,4200.0,7.0,United Kingdom,mixed,,https://news.google.com/rss/articles/CBMipgFBVV95cUxQMTZ3TTJXZWw0dmtMWTlEZmJDNkhDdmtaeUthbEgzVEJaWG8zWkpRYnBvbXVUZldiUjNJYXF1a3g1dGZ4UE1xYVRMSmRHV2FvcXRucVF6VEZrc2R4aFdLYmNtXzA1TWtROFBPa2FJWkVib0x2VTFBR0t0bzlaRFFzdGpNeWhoeGlXdTNEYS1SNEExXzI1MGtOZnZscllOMjBWRnI2cTZn?oc=5,Lancashire Telegraph,2025-01-06,Partnership for renewable energy supply; Evolve Energy aims to increase power supply from 1.2 TWh to 4.2 TWh by 2031; Shell Energy provides commodity hedging and access to renewable assets,0,
6,2023-11,2026-06-02,federal government,ArcelorMittal Belgium,,,,Belgium,other,,https://news.google.com/rss/articles/CBMinwFBVV95cUxOUHZZTWpaY0QtRGU0X3NrTmhHdG1FM2FPT1RweWlVb2U0UTZZR2o4WGV5MHlXM1ZtVDFmUWpvanZIX3Fkd19WbWZ5ZmlpV04xTWx0UHFtYW5UOHlOSi1xVFJ5dG9NZFZGbTM5NURKTkozMmQ4cnZ2T1JRNTFQS0ZQaXZDLUlGN1IySG1IOVVlTy1HVEx5ajhlY1gwYTh0aWM?oc=5,belganewsagency.eu,2025-01-06,Greening project at Ghent site; PPA with federal government and financing agreement with Flemish government,0,
5,2025-01-06,2026-06-02,Evolve Energy,Shell Energy Europe Ltd,,3.0,6.0,United Kingdom,mixed,,https://news.google.com/rss/articles/CBMiogFBVV95cUxQRGQwZGRMR1U4UjZzUDgtd095WUFFbHp6TUhTYkhCcVNQTVhjRXF4aGZtTy0wNWZNVDAyaTg4VlFldFRBUXBmcWdxZkxnM0FZSUN4Z1dSbEJXb0lxWjh0aWI3Y2lYYXJzdFowR1UzLWRoV3ZnMkpTdW10TXRiUUxsekFOWmJiWXdMdWRQLXBiWUZMcVdqczBoelRVM0kxRFdqcXc?oc=5,Solar Power Portal,2025-01-06,Long-term trading agreement providing access to renewable energy assets and commodity hedging; Evolve Energy aims to grow power supply from 1.2TWh to 4.2TWh per annum by 2031,0,
4,,2026-06-02,China Three Gorges Spain,Qualitas Energy,494.0,,,Spain,solar,,https://news.google.com/rss/articles/CBMisAFBVV95cUxNaDNUTHNsMFlUV0RDOGJFUkRKTWx5ZERub3JhckR4bE5qQk5mb1RIenhldW51YTVaeWFSdGx6SnZiLVQ2OEEwN3NCUXhvVFB6SktIS0x3emRmVVFGdXltRGg1cF9WbUI4MjlCVDQ1V21mVTN1WUZLRWxPOFdBLUZla0xfSHhhUnEwX081U1JTYVJFd25keFlEd3ZfYzAtS1MzaEtxWkVWbU9JZEEzRERQTg?oc=5,SolarQuarter,2025-01-03,Mula Solar Plant,0,
3,2025-01-01,2026-06-02,multinational consumer goods business,Emeren Group Ltd,15.0,14.958,7.0,Poland,solar,,https://news.google.com/rss/articles/CBMiswFBVV95cUxQY3pLdGMxQVVUOXhWbXdWenBtTi1uaW5sZjlxQlRSaGlUbEJlRXRnWjNiOWNyMGh5RnFlUWkxTmVoQ0wyUUF6MGNOX0JlbmFMdWtlSHM3RkE0OEU3XzQ4R3o3S1JTTXRfdDNET28yX0gtaXgyNW9SN291Z3QzZC1EcTVIY0pDVzZTd2d0QWtJdFYwbmdTbGhnYm9ENmhMdFJNQzVoY3hQOGlLaV9kQk5iVEFTQQ?oc=5,Energetica India Magazine,2025-01-01,"15 MWp solar farm in Poland's southwest Silesia region; pay-as-produced PPA; mitigates ~16,150 metric tons CO2/year; supports Poland's energy transition and local economy",0,
2,2024-03,2026-06-02,Amazon,Iberdrola,159.0,,,UK,wind offshore,,https://news.google.com/rss/articles/CBMifEFVX3lxTE1uZ3N4VUljMkZ6bUFGQ2t3R1dPb3A2b1U2TkM5dFN6NXgwbzNtSGlnRUFubjAzbFI5MjcwNkF0RUYxU3RybTM5UnJjX1JON1NhV0M1ZEhPZi1kSERwdUY4WEEzNUpBVzQ0UlRyLVRzcFFocGd5eGhYbjBFUTQ?oc=5,POWER Magazine,2025-01-02,East Anglia Three offshore wind farm in the North Sea; part of Amazon's renewable energy PPAs,0,
1,2024-11,2026-06-02,Amazon,Aer Soléir,109.3,,,Greece,wind onshore,,https://news.google.com/rss/articles/CBMifEFVX3lxTE1uZ3N4VUljMkZ6bUFGQ2t3R1dPb3A2b1U2TkM5dFN6NXgwbzNtSGlnRUFubjAzbFI5MjcwNkF0RUYxU3RybTM5UnJjX1JON1NhV0M1ZEhPZi1kSERwdUY4WEEzNUpBVzQ0UlRyLVRzcFFocGd5eGhYbjBFUTQ?oc=5,POWER Magazine,2025-01-02,"Three wind farms: Vermio (44.4 MW, Vermio North and Vermio South), Koukouras (29.5 MW), Mesokorfi (35.4 MW); expected commercial operation in 2026; part of Amazon's Climate Pledge; Aer Soléir developed all projects; Vermio includes reforestation and biodiversity programs funded by Aer Soléir",0,
