id,event_type,canonical_id,date_agreement,date_found,buyer,seller,capacity_mw,energy_gwh,tenure_years,country,technology,price_eur_mwh,source_url,source_outlet,publication_date,notes
8,N,,2023-11,2026-06-09,federal government,ArcelorMittal Belgium,,,,Belgium,other,,https://www.belganewsagency.eu/arcelormittal-to-halt-activity-in-south-africa-3500-jobs-threatened,belganewsagency.eu,2025-01-06,Greening project at Ghent site; PPA with federal government and financing agreement with Flemish government
7,N,,2024-03,2026-06-09,Securing Energy for Europe (SEFE),Oman LNG,,,10.0,Oman,other,,https://www.offshore-energy.biz/oman-lng-delivers-first-cargo-from-10-year-deal-to-its-largest-offtaker-shell/,Offshore-Energy.biz,2025-01-08,LNG supply agreement; 0.4 mtpa; formalized with SPA
6,N,,2025-01,2026-06-09,undisclosed offtaker,RWE Renewables Iberia,19.8,,,Spain,wind onshore,,https://www.rwe.com/en/press/rwe-renewables-europe-australia/2025-01-08-rwe-takes-final-investment-decision-for-repowering-of-muel-wind-farm-in-spain/,RWE,2025-01-08,Muel wind farm repowering project; 27 old turbines (16.2 MW) replaced by 3 new turbines (19.8 MW); commissioning end of 2025; funded by EU Recovery and Resilience Facility
5,N,,2025-01-06,2026-06-09,Evolve Energy,Shell Energy Europe Ltd,,3.0,,United Kingdom,mixed,,https://www.solarpowerportal.co.uk/solar-finance/evolve-energy-joins-forces-with-shell-energy-europe,Solar Power Portal,2025-01-06,Long-term trading agreement for renewable energy assets and commodity hedging; Evolve Energy aims to grow power supply from 1.2TWh to 4.2TWh per annum by 2031
4,N,,2025-01-02,2026-06-09,Qair France,Renewables Infrastructure Group (TRIG),,,,France,wind onshore,,https://hydrogeneurope.eu/trig-will-power-the-hydocc-h2-project-with-electricity-from-two-of-its-french-wind-farms/,Hydrogen Europe,2025-01-02,"Hyd’Occ H2 project in Port-la Nouvelle; green hydrogen production via water electrolysis; project under construction, planned commissioning in 2025"
3,N,,2024-03,2026-06-09,Amazon,Iberdrola,159.0,,,United Kingdom,wind offshore,,https://www.powermag.com/amazon-supports-three-new-wind-farms-in-greece/,POWER Magazine,2025-01-02,East Anglia Three offshore wind farm in the North Sea; part of Amazon's renewable energy PPAs
2,N,,2024-11,2026-06-09,Amazon,Aer Soléir,109.3,,,Greece,wind onshore,,https://www.powermag.com/amazon-supports-three-new-wind-farms-in-greece/,POWER Magazine,2025-01-02,"Three projects: Vermio Wind Farm (44.4 MW, Vermio North and Vermio South), Koukouras (29.5 MW), Mesokorfi (35.4 MW); expected commercial operation in 2026; part of Amazon's Climate Pledge commitment"
1,N,,2024,2026-06-09,Lloyds Banking Group,Low Carbon,,50.0,10.0,UK,solar,,https://www.deepskyclimate.com/blog/low-carbon-signs-long-term-power-purchase-agreement-with-carbon-removal-project-developer-deep-sky,Deep Sky Climate,2025-01-08,Two UK solar farms
